Date|Model|Grade|Sentence
30/07/2025|x-ai/grok-4-fast|0|Os membros do Copom analisaram a evolução recente e as perspectivas para a economia brasileira e para a economia internacional, no contexto do regime de política monetária, cujo objetivo é atingir a meta fixada pelo Conselho Monetário Nacional para a inflação.
30/07/2025|x-ai/grok-4-fast|0|Se, de um lado, a aprovação de alguns acordos comerciais, assim como os dados recentes de inflação e atividade da economia norte-americana poderiam sugerir uma situação de redução da incerteza global, de outro, a política fiscal e, em particular para o Brasil, a política comercial norteamericanas tornam o cenário mais incerto e mais adverso.
30/07/2025|x-ai/grok-4-fast|0|Em momentos de inflexão no ciclo econômico, é natural que se observem sinais mistos advindos de indicadores econômicos, alguns antecedentes, outros defasados, como também de comparações entre mercados, por exemplo, os mercados de crédito e de trabalho.
30/07/2025|x-ai/grok-4-fast|1|O Comitê reforça que o arrefecimento da demanda agregada é um elemento essencial do processo de reequilíbrio entre oferta e demanda da economia e convergência da inflação à meta.
30/07/2025|x-ai/grok-4-fast|-1|O Comitê reforçou a visão de que o esmorecimento no esforço de reformas estruturais e disciplina fiscal, o aumento de crédito direcionado e as incertezas sobre a estabilização da dívida pública têm o potencial de elevar a taxa de juros neutra da economia, com impactos deletérios sobre a potência da política monetária e, consequentemente, sobre o custo de desinflação em termos de atividade.
30/07/2025|x-ai/grok-4-fast|-1|As expectativas de inflação, medidas por diferentes instrumentos e obtidas de diferentes grupos de agentes, mantiveram-se acima da meta de inflação em todos os horizontes, mantendo o cenário de inflação adverso.
30/07/2025|x-ai/grok-4-fast|0|Para os horizontes mais longos, por outro lado, não houve alteração relevante entre as reuniões do Copom nas expectativas de inflação, ainda que as medidas de inflação implícita extraídas de ativos financeiros tenham se reduzido.
30/07/2025|x-ai/grok-4-fast|-1|Na discussão sobre esse tema, a principal conclusão obtida e compartilhada por todos os membros do Comitê foi de que, em um ambiente de expectativas desancoradas, como é o caso do atual, exige-se uma restrição monetária maior e por mais tempo do que outrora seria apropriado.
30/07/2025|x-ai/grok-4-fast|-1|Para além das variações dos itens, ou mesmo das oscilações de curto prazo, os núcleos de inflação têm se mantido acima do valor compatível com o atingimento da meta há meses, corroborando a interpretação de uma inflação pressionada pela demanda e que requer uma política monetária contracionista por um período bastante prolongado.
30/07/2025|x-ai/grok-4-fast|0|No cenário de referência, a trajetória para a taxa de juros é extraída da pesquisa Focus e a taxa de câmbio parte de R$5, 55/US$ 2, evoluindo segundo a paridade do poder de compra (PPC).
30/07/2025|x-ai/grok-4-fast|-1|Para o horizonte relevante de política monetária, primeiro trimestre de 2027, a projeção de inflação utilizando o cenário de referência extraído da pesquisa Focus se manteve acima da meta de inflação, em 3, 4%.
30/07/2025|x-ai/grok-4-fast|0|Com relação ao balanço de riscos, avaliou-se que o cenário de maior incerteza segue apresentando riscos mais elevados do que o usual tanto de alta quanto de baixa para o cenário de inflação.
30/07/2025|x-ai/grok-4-fast|-1|O Comitê avaliou que, entre os riscos de alta para o cenário inflacionário e as expectativas de inflação, destacam-se (i) uma desancoragem das expectativas de inflação por período mais prolongado; (ii) uma maior resiliência na inflação de serviços do que a projetada em função de um hiato do produto mais positivo; e (iii) uma conjunção de políticas econômicas externa e interna que tenham impacto inflacionário maior que o esperado, por exemplo, por meio de uma taxa de câmbio persistentemente mais depreciada.
30/07/2025|x-ai/grok-4-fast|1|Entre os riscos de baixa, ressaltam-se (i) uma eventual desaceleração da atividade econômica doméstica mais acentuada do que a projetada, tendo impactos sobre o cenário de inflação; (ii) uma desaceleração global mais pronunciada decorrente do choque de comércio e de um cenário de maior incerteza; e (iii) uma redução nos preços das commodities com efeitos desinflacionários.
30/07/2025|x-ai/grok-4-fast|-1|Prospectivamente, o Comitê seguirá acompanhando o ritmo da atividade econômica, fundamental na determinação da inflação, em particular da inflação de serviços; o repasse do câmbio para a inflação, após um processo de maior volatilidade da taxa de câmbio; e as expectativas de inflação, que se mantêm desancoradas e são determinantes para o comportamento da inflação futura.
30/07/2025|x-ai/grok-4-fast|-1|Enfatizou-se que os vetores inflacionários seguem adversos, como resiliência na atividade econômica e pressões no mercado de trabalho, expectativas de inflação desancoradas e projeções de inflação elevadas.
30/07/2025|x-ai/grok-4-fast|0|O Copom passou então à discussão da condução da política monetária, considerando o conjunto de projeções analisado, assim como o balanço de riscos para a inflação prospectiva.
30/07/2025|x-ai/grok-4-fast|-1|Ressaltou-se que, determinada a taxa apropriada de juros, ela deve permanecer em patamar significativamente contracionista por período bastante prolongado devido às expectativas desancoradas.
30/07/2025|x-ai/grok-4-fast|-1|Para assegurar a convergência da inflação à meta em ambiente de expectativas desancoradas, exige-se uma política monetária em patamar significativamente contracionista por período bastante prolongado.
30/07/2025|x-ai/grok-4-fast|0|O Copom decidiu manter a taxa básica de juros em 15, 00%, e entende que essa decisão é compatível com a estratégia de convergência da inflação para o redor da meta ao longo do horizonte relevante.
30/07/2025|x-ai/grok-4-fast|0|Sem prejuízo de seu objetivo fundamental de assegurar a estabilidade de preços, essa decisão também implica suavização das flutuações do nível de atividade econômica e fomento do pleno emprego.
30/07/2025|x-ai/grok-4-fast|0|Em se confirmando o cenário esperado, o Comitê antecipa uma continuação na interrupção no ciclo de alta de juros para examinar os impactos acumulados do ajuste já realizado, ainda por serem observados, e então avaliar se o nível corrente da taxa de juros, considerando a sua manutenção por período bastante prolongado, é suficiente para assegurar a convergência da inflação à meta.
